{
  "schema_version": "1.0.0",
  "episode_id": "PD-2026-015-theranos",
  "revision": "v001",
  "kind": "usable",
  "assets": [
    {
      "asset_id": "pexels_v_7580017",
      "asset_type": "video",
      "source": "pexels",
      "source_url": "https://www.pexels.com/video/getting-sugar-tested-7580017/",
      "author": "Pavel Danilyuk",
      "license": "Pexels License",
      "commercial_use": "allowed",
      "file": "artifact://episodes/PD-2026-015-theranos/05_stock/candidates/pexels_v_7580017.mp4",
      "sha256": "sha256:28f1b9cb2f6685ef4ab6da800698b6c6f0c7623bebe2a10a79bf723711e2e098",
      "bytes": 8247974,
      "query": "finger-prick drop vs",
      "depicts": "finger-prick drop vs",
      "fetched_at": "",
      "used_in_spans": [
        "SPN-0004"
      ],
      "gate": "usable",
      "gate_reason": "ok"
    },
    {
      "asset_id": "pexels_v_30899864",
      "asset_type": "video",
      "source": "pexels",
      "source_url": "https://www.pexels.com/video/blood-sugar-testing-procedure-with-glucometer-30899864/",
      "author": "Att Unchalisangkat",
      "license": "Pexels License",
      "commercial_use": "allowed",
      "file": "artifact://episodes/PD-2026-015-theranos/05_stock/candidates/pexels_v_30899864.mp4",
      "sha256": "sha256:07c58ea3e4cffbee7c348fa8faa5a58c55f0ec92fb6c66ac23e2b4ecd25b11e0",
      "bytes": 5212049,
      "query": "finger-prick drop vs",
      "depicts": "finger-prick drop vs",
      "fetched_at": "",
      "used_in_spans": [
        "SPN-0004"
      ],
      "gate": "usable",
      "gate_reason": "ok"
    },
    {
      "asset_id": "pexels_v_7580023",
      "asset_type": "video",
      "source": "pexels",
      "source_url": "https://www.pexels.com/video/a-doctor-pricking-the-finger-of-a-patient-for-sugar-testing-7580023/",
      "author": "Pavel Danilyuk",
      "license": "Pexels License",
      "commercial_use": "allowed",
      "file": "artifact://episodes/PD-2026-015-theranos/05_stock/candidates/pexels_v_7580023.mp4",
      "sha256": "sha256:680a3aece5fb3956bc9e500e59975e43d20a1b0ee902088ef0ce7bf40527f199",
      "bytes": 6562700,
      "query": "finger-prick drop vs",
      "depicts": "finger-prick drop vs",
      "fetched_at": "",
      "used_in_spans": [
        "SPN-0004"
      ],
      "gate": "usable",
      "gate_reason": "ok"
    },
    {
      "asset_id": "pexels_i_6823512",
      "asset_type": "image",
      "source": "pexels",
      "source_url": "https://www.pexels.com/photo/a-person-s-finger-with-blood-6823512/",
      "author": "Artem Podrez",
      "license": "Pexels License",
      "commercial_use": "allowed",
      "file": "artifact://episodes/PD-2026-015-theranos/05_stock/candidates/pexels_i_6823512.jpg",
      "sha256": "sha256:906ef18235cfe1a4edf351f86943c5dd632c6fca8a5ab22ceb9a0e5e2b600997",
      "bytes": 54289,
      "query": "finger-prick drop vs",
      "depicts": "finger-prick drop vs",
      "fetched_at": "",
      "used_in_spans": [
        "SPN-0004"
      ],
      "gate": "usable",
      "gate_reason": "ok"
    },
    {
      "asset_id": "pexels_i_12326657",
      "asset_type": "image",
      "source": "pexels",
      "source_url": "https://www.pexels.com/photo/close-up-shot-of-a-glucometer-12326657/",
      "author": "Towfiqu barbhuiya",
      "license": "Pexels License",
      "commercial_use": "allowed",
      "file": "artifact://episodes/PD-2026-015-theranos/05_stock/candidates/pexels_i_12326657.jpg",
      "sha256": "sha256:0fbe7c2358316f9b97e323212919e8a42e0e1432f962997fb422958ea5e75f74",
      "bytes": 144482,
      "query": "finger-prick drop vs",
      "depicts": "finger-prick drop vs",
      "fetched_at": "",
      "used_in_spans": [
        "SPN-0004"
      ],
      "gate": "usable",
      "gate_reason": "ok"
    },
    {
      "asset_id": "pexels_i_6823478",
      "asset_type": "image",
      "source": "pexels",
      "source_url": "https://www.pexels.com/photo/person-with-tiny-blood-on-finger-after-a-blood-test-6823478/",
      "author": "Artem Podrez",
      "license": "Pexels License",
      "commercial_use": "allowed",
      "file": "artifact://episodes/PD-2026-015-theranos/05_stock/candidates/pexels_i_6823478.jpg",
      "sha256": "sha256:fc34c6995a3a32d015a56df87c8b5c7c63a53632dae57002e4fad3ac5acf4023",
      "bytes": 59955,
      "query": "finger-prick drop vs",
      "depicts": "finger-prick drop vs",
      "fetched_at": "",
      "used_in_spans": [
        "SPN-0004"
      ],
      "gate": "usable",
      "gate_reason": "ok"
    },
    {
      "asset_id": "pixabay_v_21536",
      "asset_type": "video",
      "source": "pixabay",
      "source_url": "https://pixabay.com/videos/id-21536/",
      "author": "Engin_Akyurt",
      "license": "Pixabay Content License",
      "commercial_use": "allowed",
      "file": "artifact://episodes/PD-2026-015-theranos/05_stock/candidates/pixabay_v_21536.mp4",
      "sha256": "sha256:2ed99d82210f1a1cff70e7654929181ed57f886a1d41c1179ff5eeecce04d191",
      "bytes": 51960833,
      "query": "finger-prick drop vs",
      "depicts": "finger-prick drop vs",
      "fetched_at": "",
      "used_in_spans": [
        "SPN-0004"
      ],
      "gate": "usable",
      "gate_reason": "ok"
    },
    {
      "asset_id": "pixabay_v_28236",
      "asset_type": "video",
      "source": "pixabay",
      "source_url": "https://pixabay.com/videos/id-28236/",
      "author": "lawlaw91",
      "license": "Pixabay Content License",
      "commercial_use": "allowed",
      "file": "artifact://episodes/PD-2026-015-theranos/05_stock/candidates/pixabay_v_28236.mp4",
      "sha256": "sha256:d5051878524264dfc933fdb923d455172cdc4d7094a350d98d2b1ccb0a1ea5fc",
      "bytes": 3956789,
      "query": "finger-prick drop vs",
      "depicts": "finger-prick drop vs",
      "fetched_at": "",
      "used_in_spans": [
        "SPN-0004"
      ],
      "gate": "usable",
      "gate_reason": "ok"
    },
    {
      "asset_id": "pixabay_v_229254",
      "asset_type": "video",
      "source": "pixabay",
      "source_url": "https://pixabay.com/videos/id-229254/",
      "author": "u_0m97lsp80x",
      "license": "Pixabay Content License",
      "commercial_use": "allowed",
      "file": "artifact://episodes/PD-2026-015-theranos/05_stock/candidates/pixabay_v_229254.mp4",
      "sha256": "sha256:30a0e8f297f036c4b25c01df72ed5289a97b046684d3af6a29178e4ab6fd4fdd",
      "bytes": 34921225,
      "query": "finger-prick drop vs",
      "depicts": "finger-prick drop vs",
      "fetched_at": "",
      "used_in_spans": [
        "SPN-0004"
      ],
      "gate": "usable",
      "gate_reason": "ok"
    },
    {
      "asset_id": "pixabay_i_7589539",
      "asset_type": "image",
      "source": "pixabay",
      "source_url": "https://pixabay.com/photos/water-drop-water-drop-liquid-7589539/",
      "author": "KarenPouls",
      "license": "Pixabay Content License",
      "commercial_use": "allowed",
      "file": "artifact://episodes/PD-2026-015-theranos/05_stock/candidates/pixabay_i_7589539.jpg",
      "sha256": "sha256:ae68783661412633888c897930898aa699ebacc52c20f7676a6049e9d36d2889",
      "bytes": 95793,
      "query": "finger-prick drop vs",
      "depicts": "finger-prick drop vs",
      "fetched_at": "",
      "used_in_spans": [
        "SPN-0004"
      ],
      "gate": "usable",
      "gate_reason": "ok"
    },
    {
      "asset_id": "pixabay_i_921067",
      "asset_type": "image",
      "source": "pixabay",
      "source_url": "https://pixabay.com/photos/water-water-drop-ripples-wave-921067/",
      "author": "ClaudiaWollesen",
      "license": "Pixabay Content License",
      "commercial_use": "allowed",
      "file": "artifact://episodes/PD-2026-015-theranos/05_stock/candidates/pixabay_i_921067.jpg",
      "sha256": "sha256:8eb87a1952168f6ca6d42f560dffb1092c5e2e9e76abe577e03d3f4ea1f2224d",
      "bytes": 196805,
      "query": "finger-prick drop vs",
      "depicts": "finger-prick drop vs",
      "fetched_at": "",
      "used_in_spans": [
        "SPN-0004"
      ],
      "gate": "usable",
      "gate_reason": "ok"
    },
    {
      "asset_id": "pixabay_i_7525744",
      "asset_type": "image",
      "source": "pixabay",
      "source_url": "https://pixabay.com/photos/grass-drop-wet-7525744/",
      "author": "dandelionn",
      "license": "Pixabay Content License",
      "commercial_use": "allowed",
      "file": "artifact://episodes/PD-2026-015-theranos/05_stock/candidates/pixabay_i_7525744.jpg",
      "sha256": "sha256:83433cb0780b4a4c7001783db440cf11674e1c5ad181bf17db8e913e33f5cd6d",
      "bytes": 146767,
      "query": "finger-prick drop vs",
      "depicts": "finger-prick drop vs",
      "fetched_at": "",
      "used_in_spans": [
        "SPN-0004"
      ],
      "gate": "usable",
      "gate_reason": "ok"
    },
    {
      "asset_id": "scotus_gavel",
      "asset_type": "image",
      "source": "wikimedia",
      "source_url": "https://upload.wikimedia.org/wikipedia/commons/2/2f/Courtroom_One_Gavel_-_Flickr_-_Joe_Gratz.jpg",
      "author": null,
      "license": "CC0",
      "commercial_use": "unknown",
      "file": "assets/stock/images/scotus_gavel.jpg",
      "sha256": "sha256:0136a412a19ff46b65a36e284995679d4235eae99e37e3f8e17d026daf19a854",
      "bytes": 132428,
      "depicts": "judge's gavel",
      "gate": "usable",
      "gate_reason": "ok"
    },
    {
      "asset_id": "us_constitution_p1",
      "asset_type": "image",
      "source": "wikimedia",
      "source_url": "https://upload.wikimedia.org/wikipedia/commons/6/6c/Constitution_of_the_United_States%2C_page_1.jpg",
      "author": null,
      "license": "Public Domain",
      "commercial_use": "unknown",
      "file": "assets/stock/images/us_constitution_p1.jpg",
      "sha256": "sha256:9fcd480b19f747db2b2a2df51343f5e62a76be8c17dadf7dfa697f2436690edf",
      "bytes": 62296842,
      "depicts": "US Constitution page 1",
      "gate": "usable",
      "gate_reason": "ok"
    },
    {
      "asset_id": "bill_of_rights",